{
  "$schema": "https://json-schema.org/draft/2020-12/schema",
  "$id": "bellrock:concerto:vanilla-helpdesk:2",
  "title": "Vanilla Helpdesk model",
  "description": "Machine-readable definition of the discovered Vanilla Helpdesk configuration in the Concerto TEST environment. Grows only from evidence: nearly all properties are optional so the model never has to invent values. Every fact object carries a confidence state and evidence references.",
  "type": "object",
  "additionalProperties": false,
  "required": ["metadata", "helpdeskTypes", "evidence"],
  "properties": {
    "metadata": {
      "type": "object",
      "additionalProperties": false,
      "required": ["modelVersion", "environment", "mode"],
      "properties": {
        "modelVersion": { "enum": [1, 2], "description": "1 = frozen structural baseline shape; 2 adds per-action structured configuration promoted from evidence (2026-08-19)." },
        "environment": { "type": "string", "description": "Base URL of the authoritative TEST environment." },
        "mode": { "const": "DISCOVER", "description": "This model may only be produced in read-only DISCOVER MODE." },
        "generatedAt": { "type": "string", "description": "ISO 8601 date of last regeneration." },
        "notes": { "type": "string" }
      }
    },
    "sharedConfiguration": {
      "type": "array",
      "description": "Configuration evidenced as genuinely shared across Helpdesk Types. Do not place anything here without evidence of sharing.",
      "items": { "$ref": "#/$defs/fact" }
    },
    "helpdeskTypes": {
      "type": "array",
      "items": {
        "type": "object",
        "additionalProperties": false,
        "required": ["name", "confidence", "evidence"],
        "properties": {
          "name": { "type": "string", "description": "e.g. Reactive, Planned — as named by the system itself." },
          "confidence": { "$ref": "#/$defs/confidence" },
          "evidence": { "$ref": "#/$defs/evidenceRefs" },
          "notes": { "type": "string" },
          "statuses": { "type": "array", "items": { "$ref": "#/$defs/status" } },
          "operativeStatuses": { "type": "array", "items": { "$ref": "#/$defs/operativeStatus" } },
          "actions": { "type": "array", "items": { "$ref": "#/$defs/action" } },
          "relationships": { "type": "array", "items": { "$ref": "#/$defs/relationship" } },
          "defaults": { "type": "array", "items": { "$ref": "#/$defs/fact" } },
          "roles": { "type": "array", "items": { "$ref": "#/$defs/fact" } },
          "timers": { "type": "array", "items": { "$ref": "#/$defs/fact" } },
          "unknowns": {
            "type": "array",
            "items": { "type": "string", "description": "U-NNN id from UNKNOWNS.md" }
          }
        }
      }
    },
    "evidence": {
      "type": "array",
      "description": "The evidence index. Every evidenceRef used elsewhere must resolve to an id here.",
      "items": {
        "type": "object",
        "additionalProperties": false,
        "required": ["id", "path"],
        "properties": {
          "id": { "type": "string", "pattern": "^E-[0-9]{3,}$" },
          "path": { "type": "string", "description": "Repo-relative path under evidence/." },
          "capturedAt": { "type": "string" },
          "description": { "type": "string" }
        }
      }
    }
  },
  "$defs": {
    "confidence": {
      "enum": ["VERIFIED — OBSERVED", "VERIFIED — STRUCTURAL", "INFERRED", "UNKNOWN"]
    },
    "evidenceRefs": {
      "type": "array",
      "minItems": 1,
      "items": { "type": "string", "pattern": "^E-[0-9]{3,}$" }
    },
    "fact": {
      "type": "object",
      "description": "A generic discovered fact (defaults, roles, timers, shared configuration).",
      "additionalProperties": false,
      "required": ["statement", "confidence", "evidence"],
      "properties": {
        "id": { "type": "string" },
        "statement": { "type": "string" },
        "configurationTruth": { "type": "string", "description": "What is configured (observed)." },
        "behaviourTruth": { "type": "string", "description": "What actually happens at runtime — unverified until the EXPERIMENT phase unless safely observed." },
        "confidence": { "$ref": "#/$defs/confidence" },
        "evidence": { "$ref": "#/$defs/evidenceRefs" },
        "notes": { "type": "string" }
      }
    },
    "status": {
      "type": "object",
      "additionalProperties": false,
      "required": ["name", "confidence", "evidence"],
      "properties": {
        "name": { "type": "string" },
        "internalId": { "type": "string" },
        "description": { "type": "string" },
        "isDefault": { "type": "boolean" },
        "active": { "type": "boolean" },
        "ordering": { "type": "integer" },
        "colour": { "type": "string" },
        "icon": { "type": "string" },
        "hasOperativeEquivalent": { "type": "boolean" },
        "expiryBehaviour": { "type": "string" },
        "restrictions": { "type": "string" },
        "confidence": { "$ref": "#/$defs/confidence" },
        "evidence": { "$ref": "#/$defs/evidenceRefs" },
        "notes": { "type": "string" }
      }
    },
    "operativeStatus": {
      "type": "object",
      "additionalProperties": false,
      "required": ["name", "confidence", "evidence"],
      "properties": {
        "name": { "type": "string" },
        "isDefault": { "type": "boolean" },
        "purpose": { "type": "string" },
        "mobileRelevant": { "type": "boolean" },
        "confidence": { "$ref": "#/$defs/confidence" },
        "evidence": { "$ref": "#/$defs/evidenceRefs" },
        "notes": { "type": "string" }
      }
    },
    "action": {
      "type": "object",
      "additionalProperties": false,
      "required": ["name", "confidence", "evidence"],
      "properties": {
        "name": { "type": "string" },
        "code": { "type": "string" },
        "active": { "type": "boolean" },
        "description": { "type": "string" },
        "buttonGroup": { "type": ["string", "null"], "description": "Toolbar button group; null = no group (VI-004 for RH03b)." },
        "jobTypeScope": { "type": "string", "description": "The 'Job type' column value where non-blank (E-006)." },
        "flags": { "type": "array", "items": { "type": "string" }, "description": "Verbatim-ish attribute flags from the action list matrix (E-006)." },
        "availableIn": { "type": "array", "items": { "type": "string" }, "description": "Statuses offering this action (derived from the availability edges — same truth, per-action projection)." },
        "availableInAnyStatus": { "type": "boolean", "description": "E-007: 'Any status — no availability restriction' (G002)." },
        "resultingStatus": { "type": "string" },
        "resultingType": { "type": "string" },
        "userSelectableStatuses": { "type": "array", "items": { "type": "string" } },
        "hidden": { "type": "boolean", "description": "Hide-from-user-options ticked (E-015)." },
        "orderStatusTrigger": { "type": "string", "description": "Order status whose arrival fires this action (E-015)." },
        "orderApprovalTrigger": { "type": "boolean", "description": "'Occurs when an order is approved to a supplier' (RH05, E-015)." },
        "afpTrigger": { "type": "boolean", "description": "'Occurs when an application for payment is approved' (T09, E-015)." },
        "ordersEffects": { "type": "array", "items": { "type": "string" } },
        "constraints": { "type": "array", "items": { "type": "string" }, "description": "Prerequisite action codes (E-015; runtime semantics = U-012/E5)." },
        "timer": { "enum": ["Start", "Stop"] },
        "travel": { "enum": ["Start", "Stop"] },
        "hold": { "enum": ["on", "off"] },
        "pause": { "type": "string" },
        "defaultOrdersProject": { "type": "string" },
        "routesTo": { "type": "string", "description": "Action-route target code (G005/GM02 -> G001, E-015)." },
        "emails": { "type": "array", "items": { "type": "string" } },
        "assignment": {
          "type": "object",
          "additionalProperties": false,
          "properties": {
            "supplier": { "type": "boolean" },
            "team": { "type": "boolean" },
            "operative": { "type": "boolean" }
          }
        },
        "importanceUseFirst": { "type": "boolean" },
        "whoCanCarryOut": { "type": "string" },
        "tagAutomation": {
          "type": "object",
          "additionalProperties": false,
          "required": ["adds", "removes", "evidence"],
          "properties": {
            "adds": { "type": "array", "items": { "type": "string" } },
            "removes": { "type": "array", "items": { "type": "string" } },
            "note": { "type": "string", "description": "Carries elision/correction context verbatim from E-023/E-024; an empty removes[] with a note means the source list was elided, NOT that nothing is removed." },
            "evidence": { "$ref": "#/$defs/evidenceRefs" }
          }
        },
        "detailEvidence": { "$ref": "#/$defs/evidenceRefs" },
        "userSelectsResultingStatus": { "type": "boolean" },
        "userSelectsOperativeStatus": { "type": "boolean" },
        "mobileAvailable": { "type": "boolean" },
        "applicability": { "type": "string", "description": "Reactive / PPM applicability as evidenced." },
        "assignmentBehaviour": { "type": "string" },
        "roleRestrictions": { "type": "string" },
        "noteFileCommentRequirements": { "type": "string" },
        "timerExpiryBehaviour": { "type": "string" },
        "bulkAvailable": { "type": "boolean" },
        "hiddenOrSuppressedConditions": { "type": "string" },
        "configuratorFields": {
          "type": "array",
          "description": "Field catalogue rows from the Add/Edit Action screen.",
          "items": { "$ref": "#/$defs/configuratorField" }
        },
        "confidence": { "$ref": "#/$defs/confidence" },
        "evidence": { "$ref": "#/$defs/evidenceRefs" },
        "notes": { "type": "string" }
      }
    },
    "configuratorField": {
      "type": "object",
      "additionalProperties": false,
      "required": ["label", "confidence", "evidence"],
      "properties": {
        "label": { "type": "string" },
        "sectionOrTab": { "type": "string" },
        "controlType": { "type": "string" },
        "currentOrDefaultValue": { "type": "string" },
        "options": { "type": "array", "items": { "type": "string" } },
        "domNameOrId": { "type": "string" },
        "conditional": { "type": "boolean" },
        "conditionTrigger": { "type": "string", "description": "What causes it to appear/disappear, where observable without editing." },
        "helpText": { "type": "string" },
        "probableMeaning": { "type": "string" },
        "confidence": { "$ref": "#/$defs/confidence" },
        "evidence": { "$ref": "#/$defs/evidenceRefs" }
      }
    },
    "relationship": {
      "type": "object",
      "description": "One edge in the normalized relationship map. The kinds mirror the distinct concepts the Dev visualiser evidences — keep them distinct.",
      "additionalProperties": false,
      "required": ["kind", "confidence", "evidence"],
      "properties": {
        "kind": {
          "enum": [
            "action-available-in-status",
            "action-sets-job-status",
            "action-user-selects-status",
            "action-sets-operative-status",
            "action-user-selects-operative-status",
            "action-auto-fires-on-status-expiry"
          ]
        },
        "action": { "type": "string" },
        "fromStatus": { "type": "string" },
        "toStatus": { "type": "string" },
        "operativeStatus": { "type": "string" },
        "confidence": { "$ref": "#/$defs/confidence" },
        "evidence": { "$ref": "#/$defs/evidenceRefs" },
        "notes": { "type": "string" }
      }
    }
  }
}
