{
  "metadata": {
    "modelVersion": 1,
    "environment": "https://warwick.concertodemo.co.uk",
    "mode": "DISCOVER",
    "generatedAt": "2026-08-18",
    "notes": "Built by scripts/build_model.py from evidence E-001..E-015 (15 files; Concerto build 2026.08.9968-main). 'With AMO' status excluded: user-declared non-Vanilla addition. Safe read-only discovery complete (list-level crawl of all 43 tabs; Action configurator + 9 further Add/Edit configurators inventoried). Controlled EXPERIMENT phase not started. GUIDs referenced via model/IDENTITIES.json are environment-specific observed identities, not portable keys."
  },
  "sharedConfiguration": [
    {
      "statement": "Helpdesk Types are exactly Reactive and Planned; one Helpdesk admin page with 43 configuration tabs serves both.",
      "confidence": "VERIFIED — OBSERVED",
      "evidence": [
        "E-002"
      ]
    },
    {
      "statement": "Statuses 'Closed' and 'Cancelled' are single records shared by both Helpdesk Types (returned by both Type filters).",
      "confidence": "VERIFIED — STRUCTURAL",
      "evidence": [
        "E-003"
      ]
    },
    {
      "statement": "The 9 operative statuses are common to both Type filters (shared, or the filter does not apply — U-003).",
      "confidence": "VERIFIED — STRUCTURAL",
      "evidence": [
        "E-004"
      ]
    },
    {
      "statement": "No action has any operative-status relationship and nothing auto-fires on status expiry in Vanilla (Action map renders zero such edges; Operative status column blank on all 50 actions).",
      "confidence": "VERIFIED — OBSERVED",
      "evidence": [
        "E-006",
        "E-007"
      ]
    },
    {
      "statement": "Action map warnings: 'New PPM' and 'Business Case - R' are unreachable — no live action moves jobs into them (system's own validation; anomaly vs drawn edges recorded as U-007).",
      "confidence": "VERIFIED — OBSERVED",
      "evidence": [
        "E-007"
      ]
    },
    {
      "statement": "8 action groups exist: Reactive Helpdesk Tasks, Planned Helpdesk Tasks, General Mobile, Lead Mobile, Mobile Reactive, Mobile Planned, General Actions, Tag/Auto Actions.",
      "confidence": "VERIFIED — OBSERVED",
      "evidence": [
        "E-002"
      ]
    },
    {
      "statement": "Helpdesk job types tab defines the two Types with per-type job-creation default actions: Reactive→RH01 (default type), Planned→PH01.",
      "confidence": "VERIFIED — OBSERVED",
      "evidence": [
        "E-010"
      ]
    },
    {
      "statement": "Rule/automation surfaces are EMPTY in Vanilla: Status rules, Helpdesk rules, Appointment rules, Action routes/Overrides, Email rules, Quote rules, plus Approvers, Areas, Assignees, Audit bandings, CAPEX codes, FM task types, Hubs, Non working days, Notes/Warnings, SLA fail reasons, Short titles, Trading affected.",
      "confidence": "VERIFIED — OBSERVED",
      "evidence": [
        "E-010",
        "E-011",
        "E-012"
      ]
    },
    {
      "statement": "SLA table (Response categories): P1 2h/1d, P2 24h/3d, P3 48h/5d, P4 72h/7d, Planned 0/0, By agreement 0/0 — all on 'Standard hours' (Mon-Fri 08:30-17:30); no default flagged (VI-005).",
      "confidence": "VERIFIED — OBSERVED",
      "evidence": [
        "E-010",
        "E-012"
      ]
    },
    {
      "statement": "A parallel quote workflow exists: 1 process ('Standard process'), 8 RE-actions, 5 quote-request statuses, 2 quote statuses, 2 categories, 3 priorities. Its bridge back to job statuses is unevidenced (U-005).",
      "confidence": "VERIFIED — OBSERVED",
      "evidence": [
        "E-011"
      ]
    },
    {
      "statement": "20 typed tags (Helpdesk/Order/QuoteRequest) mirror the order-status and T-action vocabularies; actions can add/remove tags and be order-status-triggered (RH04 triggers on 'Awaiting acceptance').",
      "confidence": "VERIFIED — OBSERVED",
      "evidence": [
        "E-008",
        "E-009",
        "E-012"
      ]
    }
  ],
  "helpdeskTypes": [
    {
      "name": "Reactive",
      "confidence": "VERIFIED — OBSERVED",
      "evidence": [
        "E-002"
      ],
      "notes": "Type filter GUID ba98cba4-bb06-4347-a70a-86555149cb7c. Actions attributed to this type by their PPM/Non-PPM applicability (All-jobs actions appear under both types) — attribution rule is structural, not a system statement.",
      "statuses": [
        {
          "name": "With Helpdesk",
          "isDefault": true,
          "ordering": 10,
          "confidence": "VERIFIED — OBSERVED",
          "evidence": [
            "E-003"
          ]
        },
        {
          "name": "With Maintenance Team - R",
          "isDefault": false,
          "ordering": 20,
          "confidence": "VERIFIED — OBSERVED",
          "evidence": [
            "E-003"
          ]
        },
        {
          "name": "Awaiting Order Approval - R",
          "isDefault": false,
          "ordering": 25,
          "confidence": "VERIFIED — OBSERVED",
          "evidence": [
            "E-003"
          ]
        },
        {
          "name": "With Contractor - R",
          "isDefault": false,
          "ordering": 30,
          "confidence": "VERIFIED — OBSERVED",
          "evidence": [
            "E-003"
          ]
        },
        {
          "name": "Quote Requested - R",
          "isDefault": false,
          "ordering": 55,
          "confidence": "VERIFIED — OBSERVED",
          "evidence": [
            "E-003"
          ]
        },
        {
          "name": "Business Case - R",
          "isDefault": false,
          "ordering": 56,
          "confidence": "VERIFIED — OBSERVED",
          "evidence": [
            "E-003"
          ]
        },
        {
          "name": "Work Complete - R",
          "isDefault": false,
          "ordering": 60,
          "confidence": "VERIFIED — OBSERVED",
          "evidence": [
            "E-003"
          ]
        },
        {
          "name": "Closed",
          "isDefault": false,
          "ordering": 70,
          "confidence": "VERIFIED — STRUCTURAL",
          "evidence": [
            "E-003"
          ],
          "notes": "Flagged \"Complete\" in the Statuses tab (the only one). Returned by both the Reactive and Planned Type filters (single record)."
        },
        {
          "name": "Cancelled",
          "isDefault": false,
          "ordering": 110,
          "confidence": "VERIFIED — STRUCTURAL",
          "evidence": [
            "E-003"
          ],
          "notes": "Returned by both the Reactive and Planned Type filters (single record)."
        }
      ],
      "operativeStatuses": [
        {
          "name": "Called away",
          "confidence": "VERIFIED — OBSERVED",
          "evidence": [
            "E-004"
          ],
          "notes": "Same 9 records returned under both Type filters; whether genuinely shared or filter-ignored is U-003."
        },
        {
          "name": "Waiting for parts",
          "confidence": "VERIFIED — OBSERVED",
          "evidence": [
            "E-004"
          ],
          "notes": "Same 9 records returned under both Type filters; whether genuinely shared or filter-ignored is U-003."
        },
        {
          "name": "Paused",
          "confidence": "VERIFIED — OBSERVED",
          "evidence": [
            "E-004"
          ],
          "notes": "Same 9 records returned under both Type filters; whether genuinely shared or filter-ignored is U-003."
        },
        {
          "name": "In progress",
          "confidence": "VERIFIED — OBSERVED",
          "evidence": [
            "E-004"
          ],
          "notes": "Same 9 records returned under both Type filters; whether genuinely shared or filter-ignored is U-003."
        },
        {
          "name": "Finished shift (pause)",
          "confidence": "VERIFIED — OBSERVED",
          "evidence": [
            "E-004"
          ],
          "notes": "Same 9 records returned under both Type filters; whether genuinely shared or filter-ignored is U-003."
        },
        {
          "name": "On site",
          "confidence": "VERIFIED — OBSERVED",
          "evidence": [
            "E-004"
          ],
          "notes": "Same 9 records returned under both Type filters; whether genuinely shared or filter-ignored is U-003."
        },
        {
          "name": "On break",
          "confidence": "VERIFIED — OBSERVED",
          "evidence": [
            "E-004"
          ],
          "notes": "Same 9 records returned under both Type filters; whether genuinely shared or filter-ignored is U-003."
        },
        {
          "name": "Travelling",
          "confidence": "VERIFIED — OBSERVED",
          "evidence": [
            "E-004"
          ],
          "notes": "Same 9 records returned under both Type filters; whether genuinely shared or filter-ignored is U-003."
        },
        {
          "name": "Complete",
          "confidence": "VERIFIED — OBSERVED",
          "evidence": [
            "E-004"
          ],
          "notes": "Same 9 records returned under both Type filters; whether genuinely shared or filter-ignored is U-003."
        }
      ],
      "actions": [
        {
          "name": "G001. Add a note, photo or document",
          "code": "G001",
          "active": true,
          "applicability": "All jobs",
          "mobileAvailable": true,
          "confidence": "VERIFIED — OBSERVED",
          "evidence": [
            "E-005",
            "E-006",
            "E-007"
          ],
          "notes": "Button group: General Actions. Job type: All jobs. Flags: attachments."
        },
        {
          "name": "G002. Permit to work request",
          "code": "G002",
          "active": true,
          "applicability": "All jobs",
          "mobileAvailable": false,
          "confidence": "VERIFIED — OBSERVED",
          "evidence": [
            "E-005",
            "E-006",
            "E-007"